{
  "schema_version": "v1",
  "task_id": "fx-cn-visa-fact-001",
  "run_n": 1,
  "live": false,
  "status": "fail",
  "overall_pass": false,
  "attribution": "knowledge_gap",
  "contaminated": false,
  "scores": {
    "outcome": 0.0,
    "process": 0.5,
    "evidence": 0.0,
    "efficiency": 0.6
  }
}
